3 rows in set (0.00 sec)

mysql> show table society;
ERROR 1064 (42000): You have an error in your SQL syntax; check the manual that corresponds to your MySQL server version for the right syntax to use near 'society' at line 1
mysql> describe student;
+----------+-------------+------+-----+---------+-------+
| Field    | Type        | Null | Key | Default | Extra |
+----------+-------------+------+-----+---------+-------+
| RollNo   | varchar(10) | NO   | PRI | NULL    |       |
| Name     | varchar(30) | NO   |     | NULL    |       |
| Course   | varchar(20) | YES  |     | NULL    |       |
| DOB      | date        | YES  |     | NULL    |       |
| Email    | char(20)    | YES  |     | NULL    |       |
| Mobile   | char(10)    | YES  |     | NULL    |       |
| Semester | char(10)    | YES  |     | NULL    |       |
+----------+-------------+------+-----+---------+-------+
7 rows in set (0.00 sec)

mysql> show columns from student;
+----------+-------------+------+-----+---------+-------+
| Field    | Type        | Null | Key | Default | Extra |
+----------+-------------+------+-----+---------+-------+
| RollNo   | varchar(10) | NO   | PRI | NULL    |       |
| Name     | varchar(30) | NO   |     | NULL    |       |
| Course   | varchar(20) | YES  |     | NULL    |       |
| DOB      | date        | YES  |     | NULL    |       |
| Email    | char(20)    | YES  |     | NULL    |       |
| Mobile   | char(10)    | YES  |     | NULL    |       |
| Semester | char(10)    | YES  |     | NULL    |       |
+----------+-------------+------+-----+---------+-------+
7 rows in set (0.00 sec)

mysql> describe enrollment;
+-------------+-------------+------+-----+------------+-------+
| Field       | Type        | Null | Key | Default    | Extra |
+-------------+-------------+------+-----+------------+-------+
| RollNo      | varchar(10) | NO   | PRI | NULL       |       |
| Sid         | char(6)     | NO   | PRI | NULL       |       |
| Enroll_date | date        | YES  |     | 2023-02-01 |       |
+-------------+-------------+------+-----+------------+-------+
3 rows in set (0.00 sec)

mysql> describe society;
+-------------+--------------+------+-----+---------+-------+
| Field       | Type         | Null | Key | Default | Extra |
+-------------+--------------+------+-----+---------+-------+
| Sid         | char(6)      | NO   | PRI | NULL    |       |
| Sname       | varchar(20)  | YES  |     | NULL    |       |
| Mentor      | varchar(20)  | YES  |     | NULL    |       |
| Total_seats | int unsigned | YES  |     | 10      |       |
+-------------+--------------+------+-----+---------+-------+
4 rows in set (0.00 sec)

mysql> INSERT INTO student (RollNo, Name, Course, DOB, Email, Mobile, Semester)
    -> VALUES
    ->   ('AD-1247', 'Aarav Sharma', 'Computer', '2001-01-01', 'aarav.sharma@example.com', '9876543210', '1st'),
    ->   ('AD-1325', 'Neha Gupta', 'Physics', '2002-02-02', 'neha.gupta@example.com', '9876543211', '2nd'),
    ->   ('AD-1447', 'Siddharth Singh', 'History', '2001-01-03', 'siddharth.singh@example.com', '9876543212', '3rd'),
    ->   ('AD-1586', 'Kavya Mishra', 'Economics', '2002-02-04', 'kavya.mishra@example.com', '9876543213', '4th'),
    ->   ('AD-1669', 'Vikram Patel', 'Chemistry', '2001-01-05', 'vikram.patel@example.com', '9876543214', '5th'),
    ->   ('AD-1790', 'Riya Singhania', 'Biology', '2002-02-06', 'riya.singhania@example.com', '9876543215', '6th'),
    ->   ('AD-1812', 'Yash Verma', 'Mathematics', '2001-01-07', 'yash.verma@example.com', '9876543216', '7th'),
    ->   ('AD-1947', 'Ishika Agarwal', 'English', '2002-02-08', 'ishika.agarwal@example.com', '9876543217', '8th'),
    ->   ('AD-2021', 'Rohit Choudhary', 'Geography', '2001-01-09', 'rohit.choudhary@example.com', '9876543218', '9th'),
    ->   ('AD-2112', 'Shreya Mehra', 'Psychology', '2002-02-10', 'shreya.mehra@example.com', '9876543219', '10th');
ERROR 1406 (22001): Data too long for column 'Email' at row 1
mysql> INSERT INTO society (Sid, Sname, Mentor, Total_seats) VALUES
    -> ('S001', 'Writing', 'Amit Patel', 25),
    -> ('S002', 'Dhwani', 'Manisha Singh', 13),
    -> ('S003', 'Enactus', 'Rahul Kumar', 32),
    -> ('S004', 'Picfie', 'Priya Gupta', 19),
    -> ('S005', 'Tark', 'Arjun Singh', 22),
    -> ('S006', 'Eco', 'Nisha Sharma', 10),
    -> ('S007', 'NSS', 'Rakesh Tiwari', 15),
    -> ('S008', 'Vlab', 'Anita Verma', 27),
    -> ('S009', 'Music', 'Akhil Patel', 31),
    -> ('S010', 'Sports', 'Sneha Singh', 14);
Query OK, 10 rows affected (0.00 sec)
Records: 10  Duplicates: 0  Warnings: 0

mysql> select * from society
    -> ^C
mysql> select * from society;
+------+---------+---------------+-------------+
| Sid  | Sname   | Mentor        | Total_seats |
+------+---------+---------------+-------------+
| S001 | Writing | Amit Patel    |          25 |
| S002 | Dhwani  | Manisha Singh |          13 |
| S003 | Enactus | Rahul Kumar   |          32 |
| S004 | Picfie  | Priya Gupta   |          19 |
| S005 | Tark    | Arjun Singh   |          22 |
| S006 | Eco     | Nisha Sharma  |          10 |
| S007 | NSS     | Rakesh Tiwari |          15 |
| S008 | Vlab    | Anita Verma   |          27 |
| S009 | Music   | Akhil Patel   |          31 |
| S010 | Sports  | Sneha Singh   |          14 |
+------+---------+---------------+-------------+
10 rows in set (0.00 sec)

mysql> INSERT INTO student (RollNo, Name, Course, DOB, Email, Mobile, Semester) VALUES
    -> ('AD-1234', 'Amit Patel', 'Computer', '2001-03-05', 'amit@gmail.com', '9999999999', '4th'),
    -> ('AD-1235', 'Priya Gupta', 'Physics', '2002-05-15', 'priya@gmail.com', '8888888888', '3rd'),
    -> ('AD-1236', 'Arjun Singh', 'Chemistry', '2001-01-21', 'arjun@gmail.com', '7777777777', '2nd'),
    -> ('AD-1237', 'Manisha Singh', 'Maths', '2000-06-02', 'manisha@gmail.com', '6666666666', '3rd'),
    -> ('AD-1238', 'Rahul Kumar', 'History', '1999-11-12', 'rahul@gmail.com', '5555555555', '4th'),
    -> ('AD-1239', 'Nisha Sharma', 'Biology', '2001-02-18', 'nisha@gmail.com', '4444444444', '2nd'),
    -> ('AD-1240', 'Rakesh Tiwari', 'English', '2002-08-08', 'rakesh@gmail.com', '3333333333', '3rd'),
    -> ('AD-1241', 'Anita Verma', 'Economics', '2000-04-26', 'anita@gmail.com', '2222222222', '2nd'),
    -> ('AD-1242', 'Akhil Patel', 'Sociology', '2001-10-30', 'akhil@gmail.com', '1111111111', '4th'),
    -> ('AD-1243', 'Sneha Singh', 'Psychology', '2002-12-17', 'sneha@gmail.com', '9999999999', '3rd');
Query OK, 10 rows affected (0.00 sec)
Records: 10  Duplicates: 0  Warnings: 0

mysql> select * from students;
ERROR 1146 (42S02): Table 'student_society.students' doesn't exist
mysql> select * from student;
+---------+---------------+------------+------------+-------------------+------------+----------+
| RollNo  | Name          | Course     | DOB        | Email             | Mobile     | Semester |
+---------+---------------+------------+------------+-------------------+------------+----------+
| AD-1234 | Amit Patel    | Computer   | 2001-03-05 | amit@gmail.com    | 9999999999 | 4th      |
| AD-1235 | Priya Gupta   | Physics    | 2002-05-15 | priya@gmail.com   | 8888888888 | 3rd      |
| AD-1236 | Arjun Singh   | Chemistry  | 2001-01-21 | arjun@gmail.com   | 7777777777 | 2nd      |
| AD-1237 | Manisha Singh | Maths      | 2000-06-02 | manisha@gmail.com | 6666666666 | 3rd      |
| AD-1238 | Rahul Kumar   | History    | 1999-11-12 | rahul@gmail.com   | 5555555555 | 4th      |
| AD-1239 | Nisha Sharma  | Biology    | 2001-02-18 | nisha@gmail.com   | 4444444444 | 2nd      |
| AD-1240 | Rakesh Tiwari | English    | 2002-08-08 | rakesh@gmail.com  | 3333333333 | 3rd      |
| AD-1241 | Anita Verma   | Economics  | 2000-04-26 | anita@gmail.com   | 2222222222 | 2nd      |
| AD-1242 | Akhil Patel   | Sociology  | 2001-10-30 | akhil@gmail.com   | 1111111111 | 4th      |
| AD-1243 | Sneha Singh   | Psychology | 2002-12-17 | sneha@gmail.com   | 9999999999 | 3rd      |
+---------+---------------+------------+------------+-------------------+------------+----------+
10 rows in set (0.00 sec)

mysql> NSERT INTO enrollment (RollNo, Sid, Date_of_enrollment) VALUES
    -> ('AD-1234', 'S002', '2022-11-10'),
    -> ('AD-1235', 'S004', '2022-11-11'),
    -> ('AD-1236', 'S005', '2022-11-12'),
    -> ('AD-1237', 'S008', '2022-11-13'),
    -> ('AD-1238', 'S001', '2022-11-14'),
    -> ('AD-1239', 'S009', '2022-11-15'),
    -> ('AD-1240', 'S006', '2022-11-16'),
    -> ('AD-1241', 'S003', '2022-11-17'),
    -> ('AD-1242', 'S010', '2022-11-18'),
    -> ('AD-1243', 'S007', '2022-11-19');
ERROR 1064 (42000): You have an error in your SQL syntax; check the manual that corresponds to your MySQL server version for the right syntax to use near 'NSERT INTO enrollment (RollNo, Sid, Date_of_enrollment) VALUES
('AD-1234', 'S002' at line 1
mysql> 
mysql> INSERT INTO enrollment (RollNo, Sid, Date_of_enrollment) VALUES
    -> ('AD-1234', 'S002', '2022-11-10'),
    -> ('AD-1235', 'S004', '2022-11-11'),
    -> ('AD-1236', 'S005', '2022-11-12'),
    -> ('AD-1237', 'S008', '2022-11-13'),
    -> ('AD-1238', 'S001', '2022-11-14'),
    -> ('AD-1239', 'S009', '2022-11-15'),
    -> ('AD-1240', 'S006', '2022-11-16'),
    -> ('AD-1241', 'S003', '2022-11-17'),
    -> ('AD-1242', 'S010', '2022-11-18'),
    -> ('AD-1243', 'S007', '2022-11-19'));
ERROR 1064 (42000): You have an error in your SQL syntax; check the manual that corresponds to your MySQL server version for the right syntax to use near ')' at line 11
mysql> INSERT INTO enrollment (RollNo, Sid, Date_of_enrollment) VALUES ('AD-1234', 'S002', '2022-11-10'), ('AD-1235', 'S004', '2022-11-11'), ('AD-1236', 'S005', '2022-11-12'), ('AD-1237', 'S008', '2022-11-13'), ('AD-1238', 'S001', '2022-11-14'), ('AD-1239', 'S009', '2022-11-15'), ('AD-1240', 'S006', '2022-11-16'), ('AD-1241', 'S003', '2022-11-17'), ('AD-1242',
'S010', '2022-11-18'), ('AD-1243', 'S007', '2022-11-19');
ERROR 1054 (42S22): Unknown column 'Date_of_enrollment' in 'field list'
mysql> show columns from enrollment;
+-------------+-------------+------+-----+------------+-------+
| Field       | Type        | Null | Key | Default    | Extra |
+-------------+-------------+------+-----+------------+-------+
| RollNo      | varchar(10) | NO   | PRI | NULL       |       |
| Sid         | char(6)     | NO   | PRI | NULL       |       |
| Enroll_date | date        | YES  |     | 2023-02-01 |       |
+-------------+-------------+------+-----+------------+-------+
3 rows in set (0.00 sec)

mysql> INSERT INTO enrollment (RollNo, Sid, Enroll_date) VALUES ('AD-1234', 'S002', '2022-11-10'), ('AD-1235', 'S004', '2022-D-1239', 'S009', '2022-11-15'), ('AD-1240', 'S006', '2022-11-16'), ('AD-1241', 'S003', '2022-11-17'), ('AD-1242', 'S010', '2022-
ERROR 1452 (23000): Cannot add or update a child row: a foreign key constraint fails (`student_society`.`enrollment`, CONSTRAINT `fk2` FOREIGN KEY (`RollNo`) REFERENCES `society` (`Sid`))
mysql> CREATE TABLE enrollment (
    ->     RollNo varchar(10),
    ->     Sid char(6),
    ->     Enroll_date date DEFAULT '2023-2-1',
    ->     CONSTRAINT pk3 PRIMARY KEY (RollNo, Sid),
    ->     CONSTRAINT fk1 FOREIGN KEY (RollNo) REFERENCES student(RollNo),
    ->     CONSTRAINT fk2 FOREIGN KEY (Sid) REFERENCES society(Sid)
    -> );
ERROR 1050 (42S01): Table 'enrollment' already exists
mysql> ALTER TABLE enrollment
    -> DROP FOREIGN KEY fk2;
Query OK, 0 rows affected (0.01 sec)
Records: 0  Duplicates: 0  Warnings: 0

mysql> ALTER TABLE enrollment
    -> ADD CONSTRAINT fk2
    -> FOREIGN KEY (Sid)
    -> REFERENCES society(Sid);
Query OK, 0 rows affected (0.02 sec)
Records: 0  Duplicates: 0  Warnings: 0

mysql> INSERT INTO enrollment (RollNo, Sid, Date_of_enrollment) VALUES
    -> ('AD-1234', 'S002', '2022-11-10'),
    -> ('AD-1235', 'S004', '2022-11-11'),
    -> ('AD-1236', 'S005', '2022-11-12'),
    -> ('AD-1237', 'S008', '2022-11-13'),
    -> ('AD-1238', 'S001', '2022-11-14'),
    -> ('AD-1239', 'S009', '2022-11-15'),
    -> ('AD-1240', 'S006', '2022-11-16'),
    -> ('AD-1241', 'S003', '2022-11-17'),
    -> ('AD-1242', 'S010', '2022-11-18'),
    -> ('AD-1243', 'S007', '2022-11-19');
ERROR 1054 (42S22): Unknown column 'Date_of_enrollment' in 'field list'
mysql> 
mysql> INSERT INTO enrollment (RollNo, Sid, Enroll_date) VALUES
    -> ('AD-1234', 'S002', '2022-11-10'),
    -> ('AD-1235', 'S004', '2022-11-11'),
    -> ('AD-1236', 'S005', '2022-11-12'),
    -> ('AD-1237', 'S008', '2022-11-13'),
    -> ('AD-1238', 'S001', '2022-11-14'),
    -> ('AD-1239', 'S009', '2022-11-15'),
    -> ('AD-1240', 'S006', '2022-11-16'),
    -> ('AD-1241', 'S003', '2022-11-17'),
    -> ('AD-1242', 'S010', '2022-11-18'),
    -> ('AD-1243', 'S007', '2022-11-19');
Query OK, 10 rows affected (0.00 sec)
Records: 10  Duplicates: 0  Warnings: 0

mysql> select * from enrollment;
+---------+------+-------------+
| RollNo  | Sid  | Enroll_date |
+---------+------+-------------+
| AD-1234 | S002 | 2022-11-10  |
| AD-1235 | S004 | 2022-11-11  |
| AD-1236 | S005 | 2022-11-12  |
| AD-1237 | S008 | 2022-11-13  |
| AD-1238 | S001 | 2022-11-14  |
| AD-1239 | S009 | 2022-11-15  |
| AD-1240 | S006 | 2022-11-16  |
| AD-1241 | S003 | 2022-11-17  |
| AD-1242 | S010 | 2022-11-18  |
| AD-1243 | S007 | 2022-11-19  |
+---------+------+-------------+
10 rows in set (0.00 sec)

mysql> select name from student;
+---------------+
| name          |
+---------------+
| Amit Patel    |
| Priya Gupta   |
| Arjun Singh   |
| Manisha Singh |
| Rahul Kumar   |
| Nisha Sharma  |
mysql> select sname from society where sname like  ‘A%’;
ERROR 1064 (42000): You have an error in your SQL syntax; check the manual that corresponds to your MySQL server version for the right syntax to use near '%’' at line 1
mysql> select sname from society where sname like ‘A%’;
ERROR 1064 (42000): You have an error in your SQL syntax; check the manual that corresponds to your MySQL server version for the right syntax to use near '%’' at line 1
mysql> select * from student where name like 'A%';
+---------+-------------+-----------+------------+-----------------+------------+----------+
| RollNo  | Name        | Course    | DOB        | Email           | Mobile     | Semester |
+---------+-------------+-----------+------------+-----------------+------------+----------+
| AD-1234 | Amit Patel  | Computer  | 2001-03-05 | amit@gmail.com  | 9999999999 | 4th      |
| AD-1236 | Arjun Singh | Chemistry | 2001-01-21 | arjun@gmail.com | 7777777777 | 2nd      |
| AD-1241 | Anita Verma | Economics | 2000-04-26 | anita@gmail.com | 2222222222 | 2nd      |
| AD-1242 | Akhil Patel | Sociology | 2001-10-30 | akhil@gmail.com | 1111111111 | 4th      |
+---------+-------------+-----------+------------+-----------------+------------+----------+
4 rows in set (0.00 sec)

mysql> select name from student where name like 'A%';
+-------------+
| name        |
+-------------+
| Amit Patel  |
| Arjun Singh |
| Anita Verma |
| Akhil Patel |
+-------------+
4 rows in set (0.00 sec)

mysql> select * from students where course like 'Computer' or 'Chemistry';
ERROR 1146 (42S02): Table 'student_society.students' doesn't exist
mysql> select * from student where course like 'Computer' or 'Chemistry';
+---------+------------+----------+------------+----------------+------------+----------+
| RollNo  | Name       | Course   | DOB        | Email          | Mobile     | Semester |
+---------+------------+----------+------------+----------------+------------+----------+
| AD-1234 | Amit Patel | Computer | 2001-03-05 | amit@gmail.com | 9999999999 | 4th      |
+---------+------------+----------+------------+----------------+------------+----------+
1 row in set, 1 warning (0.00 sec)

mysql> select * from student where course = 'Computer' or course = 'Chemistry';
+---------+-------------+-----------+------------+-----------------+------------+----------+
| RollNo  | Name        | Course    | DOB        | Email           | Mobile     | Semester |
+---------+-------------+-----------+------------+-----------------+------------+----------+
| AD-1234 | Amit Patel  | Computer  | 2001-03-05 | amit@gmail.com  | 9999999999 | 4th      |
| AD-1236 | Arjun Singh | Chemistry | 2001-01-21 | arjun@gmail.com | 7777777777 | 2nd      |
+---------+-------------+-----------+------------+-----------------+------------+----------+
2 rows in set (0.00 sec)

mysql> select * from students where RollNo like 'X%' or RollNo like 'Z%';
ERROR 1146 (42S02): Table 'student_society.students' doesn't exist
mysql> select * from student where RollNo like 'X%' or RollNo like 'Z%';
Empty set (0.00 sec)

mysql> update student set RollNo = 'XD-1234' where Name = 'Amit Patel';
ERROR 1451 (23000): Cannot delete or update a parent row: a foreign key constraint fails (`student_society`.`enrollment`, CONSTRAINT `fk1` FOREIGN KEY (`RollNo`) REFERENCES `student` (`RollNo`))
mysql> select * from student where RollNo like 'X%' or RollNo like 'Z%';
Empty set (0.00 sec)

mysql> select * from society where Total_seats >10;
+------+---------+---------------+-------------+
| Sid  | Sname   | Mentor        | Total_seats |
+------+---------+---------------+-------------+
| S001 | Writing | Amit Patel    |          25 |
| S002 | Dhwani  | Manisha Singh |          13 |
| S003 | Enactus | Rahul Kumar   |          32 |
| S004 | Picfie  | Priya Gupta   |          19 |
| S005 | Tark    | Arjun Singh   |          22 |
| S007 | NSS     | Rakesh Tiwari |          15 |
| S008 | Vlab    | Anita Verma   |          27 |
| S009 | Music   | Akhil Patel   |          31 |
| S010 | Sports  | Sneha Singh   |          14 |
+------+---------+---------------+-------------+
9 rows in set (0.00 sec)

mysql> update society set Mentor = 'Ajay' where Sname = 'Writing';
Query OK, 1 row affected (0.00 sec)
Rows matched: 1  Changed: 1  Warnings: 0

mysql> select * from society;
+------+---------+---------------+-------------+
| Sid  | Sname   | Mentor        | Total_seats |
+------+---------+---------------+-------------+
| S001 | Writing | Ajay          |          25 |
| S002 | Dhwani  | Manisha Singh |          13 |
| S003 | Enactus | Rahul Kumar   |          32 |
| S004 | Picfie  | Priya Gupta   |          19 |
| S005 | Tark    | Arjun Singh   |          22 |
| S006 | Eco     | Nisha Sharma  |          10 |
| S007 | NSS     | Rakesh Tiwari |          15 |
| S008 | Vlab    | Anita Verma   |          27 |
| S009 | Music   | Akhil Patel   |          31 |
| S010 | Sports  | Sneha Singh   |          14 |
+------+---------+---------------+-------------+
10 rows in set (0.00 sec)

mysql> select * from student where rollno not in (select rollno from enrollment);
Empty set (0.00 sec)

mysql> delete from student where rollno not in (select rollno from enrollment);
Query OK, 0 rows affected (0.00 sec)

mysql> INSERT INTO student (RollNo, Name, Course, DOB, Email, Mobile, Semester) VALUES
    -> ('AD-1234', 'Amit Patel', 'Computer', '2001-03-05', 'amit@gmail.com', '9999999999', '4th'),
    -> ('AD-1234', 'Amit Patel', 'Computer', '2001-03-05', 'amit@gmail.com', '9999999999', '4th'),
    -> 
    -> ^C
mysql> INSERT INTO student (RollNo, Name, Course, DOB, Email, Mobile, Semester) VALUES
    -> ('AD-1273', 'Priyam Yadav', 'Computer', '2001-03-05', 'priyam@gmail.com', '9999999999', '4th'),
    -> ^C
mysql> ('AD-1273', 'Priyam Yadav', 'Computer', '2001-03-05', 'priyam@gmail.com', '9999999999', '4th');
ERROR 1064 (42000): You have an error in your SQL syntax; check the manual that corresponds to your MySQL server version for the right syntax to use near ''AD-1273', 'Priyam Yadav', 'Computer', '2001-03-05', 'priyam@gmail.com', '999999' at line 1
mysql> INSERT INTO student (RollNo, Name, Course, DOB, Email, Mobile, Semester) VALUES
    -> ('AD-1234', 'Priyam Yadav', 'Computer', '2001-03-05', 'priyam@gmail.com', '9999999999', '4th');
ERROR 1062 (23000): Duplicate entry 'AD-1234' for key 'student.PRIMARY'
mysql> delete from student where name = 'Priyam Yadav';
Query OK, 0 rows affected (0.00 sec)

mysql> INSERT INTO student (RollNo, Name, Course, DOB, Email, Mobile, Semester) VALUES ('AD-1273', 'Priyam Yadav', 'Computer', '2001-03-05', 'priyam@gmail.com', '9999999999', '4th');
Query OK, 1 row affected (0.00 sec)

mysql> INSERT INTO student (RollNo, Name, Course, DOB, Email, Mobile, Semester) VALUES ('AD-1277', 'Vinay Yadav', 'Computer', '2001-03-05', 'vinay@gmail.com', '9999999999', '4th');
Query OK, 1 row affected (0.00 sec)

mysql> select * from student where rollno not in (select rollno from enrollment);
+---------+--------------+----------+------------+------------------+------------+----------+
| RollNo  | Name         | Course   | DOB        | Email            | Mobile     | Semester |
+---------+--------------+----------+------------+------------------+------------+----------+
| AD-1273 | Priyam Yadav | Computer | 2001-03-05 | priyam@gmail.com | 9999999999 | 4th      |
| AD-1277 | Vinay Yadav  | Computer | 2001-03-05 | vinay@gmail.com  | 9999999999 | 4th      |
+---------+--------------+----------+------------+------------------+------------+----------+
2 rows in set (0.00 sec)

mysql> delete from student where rollno not in (select rollno from enrollment);
Query OK, 2 rows affected (0.00 sec)

mysql> select * from student;
+---------+---------------+------------+------------+-------------------+------------+----------+
| RollNo  | Name          | Course     | DOB        | Email             | Mobile     | Semester |
+---------+---------------+------------+------------+-------------------+------------+----------+
| AD-1234 | Amit Patel    | Computer   | 2001-03-05 | amit@gmail.com    | 9999999999 | 4th      |
| AD-1235 | Priya Gupta   | Physics    | 2002-05-15 | priya@gmail.com   | 8888888888 | 3rd      |
| AD-1236 | Arjun Singh   | Chemistry  | 2001-01-21 | arjun@gmail.com   | 7777777777 | 2nd      |
| AD-1237 | Manisha Singh | Maths      | 2000-06-02 | manisha@gmail.com | 6666666666 | 3rd      |
| AD-1238 | Rahul Kumar   | History    | 1999-11-12 | rahul@gmail.com   | 5555555555 | 4th      |
| AD-1239 | Nisha Sharma  | Biology    | 2001-02-18 | nisha@gmail.com   | 4444444444 | 2nd      |
| AD-1240 | Rakesh Tiwari | English    | 2002-08-08 | rakesh@gmail.com  | 3333333333 | 3rd      |
| AD-1241 | Anita Verma   | Economics  | 2000-04-26 | anita@gmail.com   | 2222222222 | 2nd      |
| AD-1242 | Akhil Patel   | Sociology  | 2001-10-30 | akhil@gmail.com   | 1111111111 | 4th      |
| AD-1243 | Sneha Singh   | Psychology | 2002-12-17 | sneha@gmail.com   | 9999999999 | 3rd      |
+---------+---------------+------------+------------+-------------------+------------+----------+
10 rows in set (0.00 sec)

mysql> update society set Total_seats = Total_seats * 1.1;
Query OK, 10 rows affected (0.00 sec)
Rows matched: 10  Changed: 10  Warnings: 0

mysql> select * from society;
+------+---------+---------------+-------------+
| Sid  | Sname   | Mentor        | Total_seats |
+------+---------+---------------+-------------+
| S001 | Writing | Ajay          |          28 |
| S002 | Dhwani  | Manisha Singh |          14 |
| S003 | Enactus | Rahul Kumar   |          35 |
| S004 | Picfie  | Priya Gupta   |          21 |
| S005 | Tark    | Arjun Singh   |          24 |
| S006 | Eco     | Nisha Sharma  |          11 |
| S007 | NSS     | Rakesh Tiwari |          17 |
| S008 | Vlab    | Anita Verma   |          30 |
| S009 | Music   | Akhil Patel   |          34 |
| S010 | Sports  | Sneha Singh   |          15 |
+------+---------+---------------+-------------+
10 rows in set (0.00 sec)

mysql> select name from student where Rollno in ( select rollno from enrollment group by rollno having count(rollno) >=2);
Empty set (0.00 sec)

mysql> INSERT INTO student (RollNo, Name, Course, DOB, Email, Mobile, Semester) VALUES ('AD-1273', 'Priyam Yadav', 'Computer', '2001-03-05', 'priyam@gmail.com', '9999999999', '4th');
Query OK, 1 row affected (0.00 sec)

mysql> INSERT INTO student (RollNo, Name, Course, DOB, Email, Mobile, Semester) VALUES ('AD-1277', 'Vinay Yadav', 'Computer', '2001-03-05', 'vinay@gmail.com', '9999999999', '4th');
Query OK, 1 row affected (0.00 sec)

mysql> select name from student where Rollno in ( select rollno from enrollment group by rollno having count(rollno) >=2);
Empty set (0.00 sec)

mysql> select sname from society where sid in (select sid from rollno);
ERROR 1146 (42S02): Table 'student_society.rollno' doesn't exist
mysql> select sname from society where sid in (select distinct(sid) from rollno);
ERROR 1146 (42S02): Table 'student_society.rollno' doesn't exist
mysql> select sname from society where sid in (select distinct(sid) from enrollment);
+---------+
| sname   |
+---------+
| Writing |
| Dhwani  |
| Enactus |
| Picfie  |
| Tark    |
| Eco     |
| NSS     |
| Vlab    |
| Music   |
| Sports  |
+---------+
10 rows in set (0.00 sec)

mysql> select name from student join enrollment on student.rollno = enrollment.rollno
    -> ^C
mysql> select name from student join enrollment on student.rollno = enrollment.rollno;
+---------------+
| name          |
+---------------+
| Rahul Kumar   |
| Amit Patel    |
| Anita Verma   |
| Priya Gupta   |
| Arjun Singh   |
| Rakesh Tiwari |
| Sneha Singh   |
| Manisha Singh |
| Nisha Sharma  |
| Akhil Patel   |
+---------------+
10 rows in set (0.00 sec)

mysql> select name from student;
+---------------+
| name          |
+---------------+
| Amit Patel    |
| Priya Gupta   |
| Arjun Singh   |
| Manisha Singh |
| Rahul Kumar   |
| Nisha Sharma  |
| Rakesh Tiwari |
| Anita Verma   |
| Akhil Patel   |
| Sneha Singh   |
| Priyam Yadav  |
| Vinay Yadav   |
+---------------+
12 rows in set (0.00 sec)

mysql> select name from student join enrollment on student.rollno = enrollment.rollno;
+---------------+
| name          |
+---------------+
| Rahul Kumar   |
| Amit Patel    |
| Anita Verma   |
| Priya Gupta   |
| Arjun Singh   |
| Rakesh Tiwari |
| Sneha Singh   |
| Manisha Singh |
| Nisha Sharma  |
| Akhil Patel   |
+---------------+
10 rows in set (0.00 sec)

mysql> select sname from society join enrollment on society.rollno = enrollment.rollno;
ERROR 1054 (42S22): Unknown column 'society.rollno' in 'on clause'
mysql> select sname from society join enrollment on society.sid = enrollment.sid;
+---------+
| sname   |
+---------+
| Writing |
| Dhwani  |
| Enactus |
| Picfie  |
| Tark    |
| Eco     |
| NSS     |
| Vlab    |
| Music   |
| Sports  |
+---------+
10 rows in set (0.00 sec)

mysql> select sname from society join enrollment on society.rollno = enrollment.rollno union select sname from society join enrollment on society.sid = enrollment.sid;
ERROR 1054 (42S22): Unknown column 'society.rollno' in 'on clause'
mysql> select name from student join enrollment on student.rollno = enrollment.rollno union select sname from society join enrollment on society.sid = enrollment.sid;
+---------------+
| name          |
+---------------+
| Rahul Kumar   |
| Amit Patel    |
| Anita Verma   |
| Priya Gupta   |
| Arjun Singh   |
| Rakesh Tiwari |
| Sneha Singh   |
| Manisha Singh |
| Nisha Sharma  |
| Akhil Patel   |
| Writing       |
| Dhwani        |
| Enactus       |
| Picfie        |
| Tark          |
| Eco           |
| NSS           |
| Vlab          |
| Music         |
| Sports        |
+---------------+
20 rows in set (0.00 sec)

mysql> SELECT student.Name
    -> FROM student
    -> JOIN enrollment ON student.RollNo = enrollment.RollNo JOIN society ON enrollment.Sid = society.Sid
    -> WHERE society.Sname IN ('NSS', 'Tark')
    -> GROUP BY student.Name
    -> HAVING COUNT(DISTINCT society.Sname) = 2;
Empty set (0.00 sec)

mysql> select * from society;
+------+---------+---------------+-------------+
| Sid  | Sname   | Mentor        | Total_seats |
+------+---------+---------------+-------------+
| S001 | Writing | Ajay          |          28 |
| S002 | Dhwani  | Manisha Singh |          14 |
| S003 | Enactus | Rahul Kumar   |          35 |
| S004 | Picfie  | Priya Gupta   |          21 |
| S005 | Tark    | Arjun Singh   |          24 |
| S006 | Eco     | Nisha Sharma  |          11 |
| S007 | NSS     | Rakesh Tiwari |          17 |
| S008 | Vlab    | Anita Verma   |          30 |
| S009 | Music   | Akhil Patel   |          34 |
| S010 | Sports  | Sneha Singh   |          15 |
+------+---------+---------------+-------------+
10 rows in set (0.00 sec)

mysql> select * from student;
+---------+---------------+------------+------------+-------------------+------------+----------+
| RollNo  | Name          | Course     | DOB        | Email             | Mobile     | Semester |
+---------+---------------+------------+------------+-------------------+------------+----------+
| AD-1234 | Amit Patel    | Computer   | 2001-03-05 | amit@gmail.com    | 9999999999 | 4th      |
| AD-1235 | Priya Gupta   | Physics    | 2002-05-15 | priya@gmail.com   | 8888888888 | 3rd      |
| AD-1236 | Arjun Singh   | Chemistry  | 2001-01-21 | arjun@gmail.com   | 7777777777 | 2nd      |
| AD-1237 | Manisha Singh | Maths      | 2000-06-02 | manisha@gmail.com | 6666666666 | 3rd      |
| AD-1238 | Rahul Kumar   | History    | 1999-11-12 | rahul@gmail.com   | 5555555555 | 4th      |
| AD-1239 | Nisha Sharma  | Biology    | 2001-02-18 | nisha@gmail.com   | 4444444444 | 2nd      |
| AD-1240 | Rakesh Tiwari | English    | 2002-08-08 | rakesh@gmail.com  | 3333333333 | 3rd      |
| AD-1241 | Anita Verma   | Economics  | 2000-04-26 | anita@gmail.com   | 2222222222 | 2nd      |
| AD-1242 | Akhil Patel   | Sociology  | 2001-10-30 | akhil@gmail.com   | 1111111111 | 4th      |
| AD-1243 | Sneha Singh   | Psychology | 2002-12-17 | sneha@gmail.com   | 9999999999 | 3rd      |
| AD-1273 | Priyam Yadav  | Computer   | 2001-03-05 | priyam@gmail.com  | 9999999999 | 4th      |
| AD-1277 | Vinay Yadav   | Computer   | 2001-03-05 | vinay@gmail.com   | 9999999999 | 4th      |
+---------+---------------+------------+------------+-------------------+------------+----------+
12 rows in set (0.00 sec)

mysql> SELECT Sname FROM society
    -> WHERE Mentor = 'Ajay'
    -> UNION
    -> SELECT Sname FROM society
    -> JOIN enrollment ON society.Sid = enrollment.Sid JOIN student ON enrollment.RollNo = student.RollNo WHERE student.Name = 'Vinay';
+---------+
| Sname   |
+---------+
| Writing |
+---------+
1 row in set (0.00 sec)

mysql> update student set name = 'Ajay' where rollno = 'AD-1234';
Query OK, 1 row affected (0.00 sec)
Rows matched: 1  Changed: 1  Warnings: 0

mysql> select * from student;
+---------+---------------+------------+------------+-------------------+------------+----------+
| RollNo  | Name          | Course     | DOB        | Email             | Mobile     | Semester |
+---------+---------------+------------+------------+-------------------+------------+----------+
| AD-1234 | Ajay          | Computer   | 2001-03-05 | amit@gmail.com    | 9999999999 | 4th      |
| AD-1235 | Priya Gupta   | Physics    | 2002-05-15 | priya@gmail.com   | 8888888888 | 3rd      |
| AD-1236 | Arjun Singh   | Chemistry  | 2001-01-21 | arjun@gmail.com   | 7777777777 | 2nd      |
| AD-1237 | Manisha Singh | Maths      | 2000-06-02 | manisha@gmail.com | 6666666666 | 3rd      |
| AD-1238 | Rahul Kumar   | History    | 1999-11-12 | rahul@gmail.com   | 5555555555 | 4th      |
| AD-1239 | Nisha Sharma  | Biology    | 2001-02-18 | nisha@gmail.com   | 4444444444 | 2nd      |
| AD-1240 | Rakesh Tiwari | English    | 2002-08-08 | rakesh@gmail.com  | 3333333333 | 3rd      |
| AD-1241 | Anita Verma   | Economics  | 2000-04-26 | anita@gmail.com   | 2222222222 | 2nd      |
| AD-1242 | Akhil Patel   | Sociology  | 2001-10-30 | akhil@gmail.com   | 1111111111 | 4th      |
| AD-1243 | Sneha Singh   | Psychology | 2002-12-17 | sneha@gmail.com   | 9999999999 | 3rd      |
| AD-1273 | Priyam Yadav  | Computer   | 2001-03-05 | priyam@gmail.com  | 9999999999 | 4th      |
| AD-1277 | Vinay Yadav   | Computer   | 2001-03-05 | vinay@gmail.com   | 9999999999 | 4th      |
+---------+---------------+------------+------------+-------------------+------------+----------+
12 rows in set (0.00 sec)

mysql> SELECT Sname FROM society WHERE Mentor IN (
    -> SELECT Name FROM student
    -> JOIN enrollment
    -> ON student.RollNo = enrollment.RollNo);
+---------+
| Sname   |
+---------+
| Writing |
| Dhwani  |
| Enactus |
| Picfie  |
| Tark    |
| Eco     |
| NSS     |
| Vlab    |
| Music   |
| Sports  |
+---------+
10 rows in set (0.00 sec)

mysql> SELECT Sname FROM society WHERE Total_seats > (
    -> SELECT COUNT(*) FROM enrollment
    -> WHERE Sid = society.Sid );
+---------+
| Sname   |
+---------+
| Writing |
| Dhwani  |
| Enactus |
| Picfie  |
| Tark    |
| Eco     |
| NSS     |
| Vlab    |
| Music   |
| Sports  |
+---------+
10 rows in set (0.00 sec)

mysql> SELECT Sname FROM society WHERE Total_seats > (
    -> SELECT COUNT(*) FROM enrollment
    -> WHERE Sid = society.Sid );
+---------+
| Sname   |
+---------+
| Writing |
| Dhwani  |
| Enactus |
| Picfie  |
| Tark    |
| Eco     |
| NSS     |
| Vlab    |
| Music   |
| Sports  |
+---------+
10 rows in set (0.00 sec)

mysql> CREATE VIEW tmp as (
    -> SELECT s.Sid, year(Date_of_enrollment) 'year’ FROM society s, enrollment e WHERE s.Sid = e.Sid
    '> GROUP BY year(Date_of_enrollment), s.Sid
    '> HAVING count(*) >= 2);
    '> 
    '> ^C
mysql> CREATE VIEW tmp as (
    -> SELECT s.Sid, year(Date_of_enrollment) 'year’ FROM society s, enrollment e WHERE s.Sid = e.Sid
    '> GROUP BY year(Date_of_enrollment), s.Sid
    '> HAVING count(*) >= 2);
    '> ^C
mysql> CREATE VIEW tmp as (
    -> SELECT s.Sid, year(Enroll_date) 'year’ FROM society s, enrollment e WHERE s.Sid = e.Sid
    '> GROUP BY year(Enroll_date), s.Sid
    '> HAVING count(*) >= 2);
    '> 
    '> ^C
mysql> CREATE VIEW tmp as (
    -> SELECT s.Sid, year(Enroll_date) 'year’ FROM society s, enrollment e WHERE s.Sid = e.Sid
    '> GROUP BY year(Enroll_date), s.Sid
    '> HAVING count(*) >= 2);
    '> ^C
mysql> desc society;
+-------------+--------------+------+-----+---------+-------+
| Field       | Type         | Null | Key | Default | Extra |
+-------------+--------------+------+-----+---------+-------+
| Sid         | char(6)      | NO   | PRI | NULL    |       |
| Sname       | varchar(20)  | YES  |     | NULL    |       |
| Mentor      | varchar(20)  | YES  |     | NULL    |       |
| Total_seats | int unsigned | YES  |     | 10      |       |
+-------------+--------------+------+-----+---------+-------+
4 rows in set (0.00 sec)

mysql> CREATE VIEW tmp as (
    -> SELECT s.Sid, year(Enroll_date) 'year’ FROM society s, enrollment e WHERE s.Sid = e.Sid
    '> GROUP BY year(Enroll_date), s.Sid
    '> HAVING count(*) >= 2);
    '> 
    '> ^C
mysql> ALTER TABLE enrollment
    -> ADD fees_paid enum('Yes', 'No');
Query OK, 0 rows affected (0.01 sec)
Records: 0  Duplicates: 0  Warnings: 0

mysql> desc enrollment;
+-------------+------------------+------+-----+------------+-------+
| Field       | Type             | Null | Key | Default    | Extra |
+-------------+------------------+------+-----+------------+-------+
| RollNo      | varchar(10)      | NO   | PRI | NULL       |       |
| Sid         | char(6)          | NO   | PRI | NULL       |       |
| Enroll_date | date             | YES  |     | 2023-02-01 |       |
| fees_paid   | enum('Yes','No') | YES  |     | NULL       |       |
+-------------+------------------+------+-----+------------+-------+
4 rows in set (0.00 sec)

mysql> SELECT Sname FROM society WHERE total_seats <= (
    -> SELECT COUNT(*) FROM enrollment
    -> WHERE enrollment.Sid = society.Sid );
Empty set (0.00 sec)

mysql> select * from enrollment;
+---------+------+-------------+-----------+
| RollNo  | Sid  | Enroll_date | fees_paid |
+---------+------+-------------+-----------+
| AD-1234 | S002 | 2022-11-10  | NULL      |
| AD-1235 | S004 | 2022-11-11  | NULL      |
| AD-1236 | S005 | 2022-11-12  | NULL      |
| AD-1237 | S008 | 2022-11-13  | NULL      |
| AD-1238 | S001 | 2022-11-14  | NULL      |
| AD-1239 | S009 | 2022-11-15  | NULL      |
| AD-1240 | S006 | 2022-11-16  | NULL      |
| AD-1241 | S003 | 2022-11-17  | NULL      |
| AD-1242 | S010 | 2022-11-18  | NULL      |
| AD-1243 | S007 | 2022-11-19  | NULL      |
+---------+------+-------------+-----------+
10 rows in set (0.00 sec)

mysql> UPDATE enrollment
    -> SET Enroll_date =
    -> CASE
    -> WHEN Sid = 'S004' THEN '2018-01-15' WHEN Sid = 'S005' THEN CURDATE() WHEN Sid = 'S008' THEN '2018-01-02'
    -> END
    -> WHERE Sid IN ('S004', 'S005', 'S008');
Query OK, 3 rows affected (0.01 sec)
Rows matched: 3  Changed: 3  Warnings: 0

mysql> select * from enrollment;
+---------+------+-------------+-----------+
| RollNo  | Sid  | Enroll_date | fees_paid |
+---------+------+-------------+-----------+
| AD-1234 | S002 | 2022-11-10  | NULL      |
| AD-1235 | S004 | 2018-01-15  | NULL      |
| AD-1236 | S005 | 2023-02-21  | NULL      |
| AD-1237 | S008 | 2018-01-02  | NULL      |
| AD-1238 | S001 | 2022-11-14  | NULL      |
| AD-1239 | S009 | 2022-11-15  | NULL      |
| AD-1240 | S006 | 2022-11-16  | NULL      |
| AD-1241 | S003 | 2022-11-17  | NULL      |
| AD-1242 | S010 | 2022-11-18  | NULL      |
| AD-1243 | S007 | 2022-11-19  | NULL      |
+---------+------+-------------+-----------+
10 rows in set (0.00 sec)

mysql> 
mysql> SELECT Sname FROM society s
    -> INNER JOIN enrollment e ON s.Sid = e.Sid INNER JOIN student st ON e.rollno = st.rollno WHERE st.Course IN ('Phy', 'Chem')
    -> GROUP BY s.Sname
    -> HAVING COUNT(DISTINCT e.rollno) = 2;
Empty set (0.00 sec)

mysql> SELECT Sname FROM society s
    -> INNER JOIN enrollment e ON s.Sid = e.Sid INNER JOIN student st ON e.rollno = st.rollno WHERE st.Course IN ('Physics', 'Chemistry')
    -> GROUP BY s.Sname
    -> HAVING COUNT(DISTINCT e.rollno) = 2;
Empty set (0.00 sec)

mysql> CREATE VIEW view1 AS
    -> SELECT s.Sname, COUNT(e.Sid) AS num_enrolled FROM society s
    -> LEFT JOIN enrollment e ON s.Sid = e.Sid
    -> GROUP BY s.Sname;
Query OK, 0 rows affected (0.01 sec)

mysql> select * from view1;
+---------+--------------+
| Sname   | num_enrolled |
+---------+--------------+
| Writing |            1 |
| Dhwani  |            1 |
| Enactus |            1 |
| Picfie  |            1 |
| Tark    |            1 |
| Eco     |            1 |
| NSS     |            1 |
| Vlab    |            1 |
| Music   |            1 |
| Sports  |            1 |
+---------+--------------+
10 rows in set (0.00 sec)

mysql> SELECT Name FROM student WHERE RollNo in (
    -> SELECT RollNo FROM enrollment GROUP BY RollNo
    -> HAVING COUNT(RollNo) = 10
    -> );
Empty set (0.00 sec)

mysql> ALTER TABLE student
    -> ADD COLUMN contact VARCHAR(10) DEFAULT ‘ground';
    '> ^C
mysql> ALTER TABLE student
    -> ADD COLUMN contact VARCHAR(10) DEFAULT ‘ground';
    '> 
    '> ^C
mysql> alter table student
    -> ADD COLUMN contact VARCHAR(10) DEFAULT ‘ground';
    '> ^C
mysql> select * from student;
+---------+---------------+------------+------------+-------------------+------------+----------+
| RollNo  | Name          | Course     | DOB        | Email             | Mobile     | Semester |
+---------+---------------+------------+------------+-------------------+------------+----------+
| AD-1234 | Ajay          | Computer   | 2001-03-05 | amit@gmail.com    | 9999999999 | 4th      |
| AD-1235 | Priya Gupta   | Physics    | 2002-05-15 | priya@gmail.com   | 8888888888 | 3rd      |
| AD-1236 | Arjun Singh   | Chemistry  | 2001-01-21 | arjun@gmail.com   | 7777777777 | 2nd      |
| AD-1237 | Manisha Singh | Maths      | 2000-06-02 | manisha@gmail.com | 6666666666 | 3rd      |
| AD-1238 | Rahul Kumar   | History    | 1999-11-12 | rahul@gmail.com   | 5555555555 | 4th      |
| AD-1239 | Nisha Sharma  | Biology    | 2001-02-18 | nisha@gmail.com   | 4444444444 | 2nd      |
| AD-1240 | Rakesh Tiwari | English    | 2002-08-08 | rakesh@gmail.com  | 3333333333 | 3rd      |
| AD-1241 | Anita Verma   | Economics  | 2000-04-26 | anita@gmail.com   | 2222222222 | 2nd      |
| AD-1242 | Akhil Patel   | Sociology  | 2001-10-30 | akhil@gmail.com   | 1111111111 | 4th      |
| AD-1243 | Sneha Singh   | Psychology | 2002-12-17 | sneha@gmail.com   | 9999999999 | 3rd      |
| AD-1273 | Priyam Yadav  | Computer   | 2001-03-05 | priyam@gmail.com  | 9999999999 | 4th      |
| AD-1277 | Vinay Yadav   | Computer   | 2001-03-05 | vinay@gmail.com   | 9999999999 | 4th      |
+---------+---------------+------------+------------+-------------------+------------+----------+
12 rows in set (0.00 sec)

mysql> desc student;
+----------+-------------+------+-----+---------+-------+
| Field    | Type        | Null | Key | Default | Extra |
+----------+-------------+------+-----+---------+-------+
| RollNo   | varchar(10) | NO   | PRI | NULL    |       |
| Name     | varchar(30) | NO   |     | NULL    |       |
| Course   | varchar(20) | YES  |     | NULL    |       |
| DOB      | date        | YES  |     | NULL    |       |
| Email    | char(20)    | YES  |     | NULL    |       |
| Mobile   | char(10)    | YES  |     | NULL    |       |
| Semester | char(10)    | YES  |     | NULL    |       |
+----------+-------------+------+-----+---------+-------+
7 rows in set (0.01 sec)

mysql> ALTER TABLE student
    -> ADD COLUMN contact VARCHAR(10) DEFAULT ‘ground';
    '> ^C
mysql> ALTER TABLE student ADD COLUMN contact VARCHAR(10) DEFAULT ‘ground';
    '> ^C
mysql> ALTER TABLE student ADD COLUMN contact VARCHAR(15) DEFAULT '';
Query OK, 0 rows affected (0.01 sec)
Records: 0  Duplicates: 0  Warnings: 0

mysql> CREATE VIEW tmp AS
    -> SELECT SID, COUNT(*) count FROM enrollment GROUP BY Sid;
Query OK, 0 rows affected (0.00 sec)

mysql> SELECT Sname most_popular FROM society WHERE Sid in (
    -> SELECT Sid FROM tmp
    -> WHERE count = (SELECT MAX(count) FROM tmp));
+--------------+
| most_popular |
+--------------+
| Writing      |
| Dhwani       |
| Enactus      |
| Picfie       |
| Tark         |
| Eco          |
| NSS          |
| Vlab         |
| Music        |
| Sports       |
+--------------+
10 rows in set (0.01 sec)

mysql> SELECT Sname least_popular FROM society WHERE Sid in (
    -> SELECT Sid FROM tmp
    -> WHERE count = (SELECT MIN(count) FROM tmp));
+---------------+
| least_popular |
+---------------+
| Writing       |
| Dhwani        |
| Enactus       |
| Picfie        |
| Tark          |
| Eco           |
| NSS           |
| Vlab          |
| Music         |
| Sports        |
+---------------+
10 rows in set (0.00 sec)

mysql> select * from student;
+---------+---------------+------------+------------+-------------------+------------+----------+---------+
| RollNo  | Name          | Course     | DOB        | Email             | Mobile     | Semester | contact |
+---------+---------------+------------+------------+-------------------+------------+----------+---------+
| AD-1234 | Ajay          | Computer   | 2001-03-05 | amit@gmail.com    | 9999999999 | 4th      |         |
| AD-1235 | Priya Gupta   | Physics    | 2002-05-15 | priya@gmail.com   | 8888888888 | 3rd      |         |
| AD-1236 | Arjun Singh   | Chemistry  | 2001-01-21 | arjun@gmail.com   | 7777777777 | 2nd      |         |
| AD-1237 | Manisha Singh | Maths      | 2000-06-02 | manisha@gmail.com | 6666666666 | 3rd      |         |
| AD-1238 | Rahul Kumar   | History    | 1999-11-12 | rahul@gmail.com   | 5555555555 | 4th      |         |
| AD-1239 | Nisha Sharma  | Biology    | 2001-02-18 | nisha@gmail.com   | 4444444444 | 2nd      |         |
| AD-1240 | Rakesh Tiwari | English    | 2002-08-08 | rakesh@gmail.com  | 3333333333 | 3rd      |         |
| AD-1241 | Anita Verma   | Economics  | 2000-04-26 | anita@gmail.com   | 2222222222 | 2nd      |         |
| AD-1242 | Akhil Patel   | Sociology  | 2001-10-30 | akhil@gmail.com   | 1111111111 | 4th      |         |
| AD-1243 | Sneha Singh   | Psychology | 2002-12-17 | sneha@gmail.com   | 9999999999 | 3rd      |         |
| AD-1273 | Priyam Yadav  | Computer   | 2001-03-05 | priyam@gmail.com  | 9999999999 | 4th      |         |
| AD-1277 | Vinay Yadav   | Computer   | 2001-03-05 | vinay@gmail.com   | 9999999999 | 4th      |         |
+---------+---------------+------------+------------+-------------------+------------+----------+---------+
12 rows in set (0.00 sec)

mysql> SELECT Name FROM student WHERE RollNo IN (
    -> SELECT RollNo FROM enrollment ) AND year(DOB) = 2001;
+--------------+
| Name         |
+--------------+
| Ajay         |
| Arjun Singh  |
| Nisha Sharma |
| Akhil Patel  |
+--------------+
4 rows in set (0.00 sec)

mysql> ALTER TABLE student ALTER COLUMN contact DROP DEFAULT;
Query OK, 0 rows affected (0.01 sec)
Records: 0  Duplicates: 0  Warnings: 0

mysql> desc student;
+----------+-------------+------+-----+---------+-------+
| Field    | Type        | Null | Key | Default | Extra |
+----------+-------------+------+-----+---------+-------+
| RollNo   | varchar(10) | NO   | PRI | NULL    |       |
| Name     | varchar(30) | NO   |     | NULL    |       |
| Course   | varchar(20) | YES  |     | NULL    |       |
| DOB      | date        | YES  |     | NULL    |       |
| Email    | char(20)    | YES  |     | NULL    |       |
| Mobile   | char(10)    | YES  |     | NULL    |       |
| Semester | char(10)    | YES  |     | NULL    |       |
| contact  | varchar(15) | YES  |     | NULL    |       |
+----------+-------------+------+-----+---------+-------+
8 rows in set (0.00 sec)

mysql> SELECT Sname FROM society
    -> WHERE Sid IN (
    -> SELECT Sid FROM enrollment
    -> WHERE MONTH(Enroll_date) IN (1, 2));
+--------+
| Sname  |
+--------+
| Picfie |
| Tark   |
| Vlab   |
+--------+
3 rows in set (0.00 sec)

mysql> SELECT st.*, s.Sname
    -> FROM student st
    -> LEFT JOIN enrollment e ON st.RollNo = e.RollNo LEFT JOIN society s ON e.Sid = s.Sid;
+---------+---------------+------------+------------+-------------------+------------+----------+---------+---------+
| RollNo  | Name          | Course     | DOB        | Email             | Mobile     | Semester | contact | Sname   |
+---------+---------------+------------+------------+-------------------+------------+----------+---------+---------+
| AD-1234 | Ajay          | Computer   | 2001-03-05 | amit@gmail.com    | 9999999999 | 4th      |         | Dhwani  |
| AD-1235 | Priya Gupta   | Physics    | 2002-05-15 | priya@gmail.com   | 8888888888 | 3rd      |         | Picfie  |
| AD-1236 | Arjun Singh   | Chemistry  | 2001-01-21 | arjun@gmail.com   | 7777777777 | 2nd      |         | Tark    |
| AD-1237 | Manisha Singh | Maths      | 2000-06-02 | manisha@gmail.com | 6666666666 | 3rd      |         | Vlab    |
| AD-1238 | Rahul Kumar   | History    | 1999-11-12 | rahul@gmail.com   | 5555555555 | 4th      |         | Writing |
| AD-1239 | Nisha Sharma  | Biology    | 2001-02-18 | nisha@gmail.com   | 4444444444 | 2nd      |         | Music   |
| AD-1240 | Rakesh Tiwari | English    | 2002-08-08 | rakesh@gmail.com  | 3333333333 | 3rd      |         | Eco     |
| AD-1241 | Anita Verma   | Economics  | 2000-04-26 | anita@gmail.com   | 2222222222 | 2nd      |         | Enactus |
| AD-1242 | Akhil Patel   | Sociology  | 2001-10-30 | akhil@gmail.com   | 1111111111 | 4th      |         | Sports  |
| AD-1243 | Sneha Singh   | Psychology | 2002-12-17 | sneha@gmail.com   | 9999999999 | 3rd      |         | NSS     |
| AD-1273 | Priyam Yadav  | Computer   | 2001-03-05 | priyam@gmail.com  | 9999999999 | 4th      |         | NULL    |
| AD-1277 | Vinay Yadav   | Computer   | 2001-03-05 | vinay@gmail.com   | 9999999999 | 4th      |         | NULL    |
+---------+---------------+------------+------------+-------------------+------------+----------+---------+---------+
12 rows in set (0.00 sec)

mysql> SELECT LPAD(UPPER(Sname), 10, '*') AS Sname FROM society
    -> WHERE Mentor LIKE 'A%t' AND
    -> 10 <= Total_seats AND Total_seats <= 20;
Empty set (0.00 sec)

mysql> 